{
  "schema": "szk.ma.headhunter.cassette/v1",
  "name": "scopus-unauthorized-no-key-401",
  "recorded_at": "2026-10-05T11:08:29Z",
  "origin": "recorded",
  "unverified_live": false,
  "license_note": null,
  "notes": "VALÓS 401 kulcs nélkül: AUTHENTICATION_ERROR (service-error alak)",
  "interactions": [
    {
      "request": {
        "method": "GET",
        "url": "https://api.elsevier.com/content/search/scopus?count=1&field=dc%3Aidentifier%2Ceid&query=PMID%288309034%29",
        "headers": {
          "accept": "application/json"
        }
      },
      "response": {
        "status": 401,
        "headers": {
          "content-type": "application/json;charset=UTF-8",
          "x-els-status": "AUTHENTICATION_ERROR - Invalid API Key"
        },
        "body_json": {
          "service-error": {
            "status": {
              "statusCode": "AUTHENTICATION_ERROR",
              "statusText": "Invalid API Key"
            }
          }
        }
      },
      "delay_ms": null
    }
  ]
}
