{
  "schema": "szk.ma.headhunter.cassette/v1",
  "name": "europepmc-fulltext-oa-synthetic-handmade",
  "recorded_at": "2026-10-05T12:00:00Z",
  "origin": "hand_made",
  "unverified_live": false,
  "license_note": "szintetikus szöveg (nem valós cikk)",
  "notes": "KÉZI: /PMC0000001/fullTextXML 200 — SZINTETIKUS minimális JATS (a keresési dátum Methods-ból olvasható); valós teljes szöveg nem kerül a repóba (N4)",
  "interactions": [
    {
      "request": {
        "method": "GET",
        "url": "https://www.ebi.ac.uk/europepmc/webservices/rest/PMC0000001/fullTextXML"
      },
      "response": {
        "status": 200,
        "headers": {
          "content-type": "application/xml"
        },
        "body_text": "<?xml version=\"1.0\" encoding=\"UTF-8\"?><article xmlns:xlink=\"http://www.w3.org/1999/xlink\"><front><article-meta><article-id pub-id-type=\"pmcid\">PMC0000001</article-id><title-group><article-title>Synthetic review (fixture)</article-title></title-group></article-meta></front><body><sec><title>Methods</title><p>We searched MEDLINE, Embase and CENTRAL from inception to 15 March 2020.</p></sec></body><back><ref-list><ref id=\"r1\"><mixed-citation>Alpha A. Synthetic trial. Fixture J. 2010;1:1-2.</mixed-citation></ref></ref-list></back></article>"
      },
      "delay_ms": null
    }
  ]
}
