{
  "schema": "szk.ma.headhunter.cassette/v1",
  "name": "openalex-check",
  "recorded_at": "2026-10-05T11:08:26Z",
  "origin": "recorded",
  "unverified_live": false,
  "license_note": null,
  "notes": "OpenAlex próbakérés: /works/pmid:8309034?select=id (ingyenes) — keret-fejlécekkel",
  "interactions": [
    {
      "request": {
        "method": "GET",
        "url": "https://api.openalex.org/works/pmid:8309034?select=id",
        "headers": {
          "accept": "application/json"
        }
      },
      "response": {
        "status": 200,
        "headers": {
          "content-type": "application/json",
          "x-ratelimit-cost-usd": "0",
          "x-ratelimit-credits-used": "0",
          "x-ratelimit-limit": "1000",
          "x-ratelimit-limit-usd": "0.1",
          "x-ratelimit-onetime-remaining": "0",
          "x-ratelimit-prepaid-remaining-usd": "0",
          "x-ratelimit-remaining": "0",
          "x-ratelimit-remaining-usd": "0",
          "x-ratelimit-reset": "46294"
        },
        "body_json": {
          "id": "https://openalex.org/W2075477269"
        }
      },
      "delay_ms": null
    }
  ]
}
