{
  "schema": "szk.ma.headhunter.cassette/v1",
  "name": "ctgov-check",
  "recorded_at": "2026-10-05T11:08:12Z",
  "origin": "recorded",
  "unverified_live": false,
  "license_note": null,
  "notes": "ClinicalTrials.gov próbakérés: /api/v2/version",
  "interactions": [
    {
      "request": {
        "method": "GET",
        "url": "https://clinicaltrials.gov/api/v2/version",
        "headers": {
          "accept": "application/json"
        }
      },
      "response": {
        "status": 200,
        "headers": {
          "content-type": "application/json"
        },
        "body_json": {
          "apiVersion": "2.0.5",
          "dataTimestamp": "2026-10-02T09:00:04"
        }
      },
      "delay_ms": null
    }
  ]
}
